{
  "schema_version": "category-profile-v1",
  "profile_id": "robot-vacuum-ko-v1",
  "version": "0.1.0",
  "language": "ko",
  "category": "테크·가전",
  "product_types": [
    "로봇청소기",
    "올인원 로봇청소기",
    "도킹 스테이션 로봇청소기"
  ],
  "match_terms": [
    "로봇청소기",
    "흡입력",
    "물걸레",
    "도킹 스테이션",
    "LDS",
    "LiDAR",
    "장애물 감지"
  ],
  "semantic_slot_guidance": {
    "product_identity": {
      "extraction_hints": ["제품명", "제품 유형", "도크 유형"],
      "question_examples": ["제품명과 로봇청소기 유형을 알려 주세요."]
    },
    "key_strengths": {
      "extraction_hints": ["흡입력", "물걸레 방식", "센서", "도크 자동화", "본체 크기"],
      "question_examples": ["흡입·물걸레·주행·도크에서 핵심 특장점은 무엇인가요?"]
    },
    "target_supporters": {
      "extraction_hints": ["가구 형태", "반려동물", "바닥 유형", "주거 면적"],
      "question_examples": ["어떤 주거 환경과 사용자에게 필요한 제품인가요?"]
    },
    "problem_context": {
      "extraction_hints": ["반복 청소", "가구 아래", "털과 모래", "카펫과 마루"],
      "question_examples": ["타깃 사용자가 반복해서 겪는 바닥 관리 불편은 무엇인가요?"]
    },
    "trust_elements": {
      "extraction_hints": ["시험 조건", "인증", "후기", "특허", "수상"],
      "question_examples": ["제품 수치나 성능을 뒷받침하는 시험·인증·후기가 있나요?"]
    },
    "maker_team_intro": {
      "extraction_hints": ["팀 역할", "관련 경력", "개발 기간", "개발 동기"],
      "question_examples": ["메이커와 팀의 역할·관련 경험·개발 배경을 알려 주세요."]
    }
  },
  "template_soft_boosts": {
    "t01_performance_value_evidence": 2,
    "t02_problem_solution_automation": 3,
    "t03_lifestyle_social_proof": 0,
    "t04_full_campaign": 4
  }
}
